{
  "$schema": "./current-release.schema.json",
  "schemaVersion": 1,
  "product": "ForgePlay",
  "channel": "stable",
  "marketingVersion": "2.4.0",
  "buildNumber": 11,
  "releaseTag": "v2.4.0",
  "publishedAt": "2026-10-22T22:48:18Z",
  "minimumMacOSVersion": "27.0",
  "releaseURL": "https://github.com/Facta-Leopard/ForgePlay/releases/tag/v2.4.0",
  "download": {
    "assetName": "ForgePlay-2.4.0-11.dmg",
    "url": "https://github.com/Facta-Leopard/ForgePlay/releases/download/v2.4.0/ForgePlay-2.4.0-11.dmg",
    "sha256": "7547f892725d99b3129797c9d17efe18477e977ec11c0972070596c268f70f23",
    "byteSize": 1259139015
  }
}
